{
  "$schema": "http://json-schema.org/draft-04/schema#",
  "title": "COBRA",
  "description": "JSON representation of COBRA model",
  "definitions": {
    "metadata": {
      "type": "object",
      "properties": {
        "sbo": {
          "type": "string"
        },
        "standardized": {
          "type": "array",
          "items": {
            "type": "object",
            "properties": {
              "qualifiers": {
                "type": "string"
              },
              "resources": {
                "type": "array",
                "items": {
                  "type": "string"
                }
              },
              "annotations": {
                "$ref": "#/definitions/metadata/standardized"
              }
            }
          }
        },
        "history": {
          "type": "object",
          "properties": {
            "creators": {
              "type": "array",
              "items": {
                "type": "object",
                "properties": {
                  "email": {
                    "type": "string"
                  },
                  "name": {
                    "type": "string"
                  },
                  "organisation": {
                    "type": "string"
                  }
                },
                "required": ["name"],
                "additionalProperties": false
              }
            },
            "created_date": {
              "type": "string",
              "format": "date-time"
            },
            "modified_dates": {
              "type": "array",
              "items": {
                "type": "string",
                "format": "date-time"
              }
            }
          },
          "required": ["creators", "created_date", "modified_dates"],
          "additionalProperties": false
        },
        "listofkeyvalue": {
          "type": "array",
          "items": {
            "type": "object",
            "properties": {
              "id": {
                "type": "string",
                "pattern": "^[a-zA-Z|_][a-zA-Z0-9_]*$"
              },
              "name": {
                "type": "string"
              },
              "key": {
                "type": "string"
              },
              "value": {
                "type": "string"
              },
              "uri": {
                "type": "string"
              }
            },
            "required": ["key"],
            "additionalProperties": false
          }
        }
      }
    }
  },
  "type": "object",
  "properties": {
    "id": {
      "type": "string",
      "pattern": "^[a-zA-Z|_][a-zA-Z0-9_]*$"
    },
    "name": {
      "type": "string"
    },
    "version": {
      "type": "string",
      "default": "1"
    },
    "reactions": {
      "type": "array",
      "items": {
        "type": "object",
        "properties": {
          "id": {
            "type": "string",
            "pattern": "^[a-zA-Z|_][a-zA-Z0-9_]*$"
          },
          "name": {
            "type": "string"
          },
          "metabolites": {
            "type": "object",
            "patternProperties": {
              ".*": {
                "type": "number"
              }
            }
          },
          "gene_reaction_rule": {
            "type": "string"
          },
          "lower_bound": {
            "type": "number"
          },
          "upper_bound": {
            "type": "number"
          },
          "objective_coefficient": {
            "type": "number",
            "default": 0
          },
          "subsystem": {
            "type": "string"
          },
          "notes": {
            "type": "string"
          },
          "metadata": {
            "$ref": "#/definitions/metadata"
          }
        },
        "required": [
          "id",
          "name",
          "metabolites",
          "lower_bound",
          "upper_bound",
          "gene_reaction_rule"
        ],
        "additionalProperties": false
      }
    },
    "metabolites": {
      "type": "array",
      "items": {
        "type": "object",
        "properties": {
          "id": {
            "type": "string",
            "pattern": "^[a-zA-Z|_][a-zA-Z0-9_]*$"
          },
          "name": {
            "type": "string"
          },
          "compartment": {
            "type": "string",
            "pattern": "[a-z]{1,2}"
          },
          "charge": {
            "type": "integer"
          },
          "formula": {
            "type": "string"
          },
          "_bound": {
            "type": "number",
            "default": 0
          },
          "notes": {
            "type": "string"
          },
          "metadata": {
            "$ref": "#/definitions/metadata"
          }
        },
        "required": ["id", "name", "compartment"],
        "additionalProperties": false
      }
    },
    "genes": {
      "type": "array",
      "items": {
        "type": "object",
        "properties": {
          "id": {
            "type": "string",
            "pattern": "^[a-zA-Z|_][a-zA-Z0-9_]*$"
          },
          "name": {
            "type": "string"
          },
          "notes": {
            "type": "string"
          },
          "metadata": {
            "$ref": "#/definitions/metadata"
          }
        },
        "required": ["id", "name"],
        "additionalProperties": false
      }
    },
    "compartments": {
      "type": "object",
      "patternProperties": {
        "[a-z]{1,2}": {
          "type": "string"
        }
      }
    },
    "groups": {
      "type": "array",
      "items": {
        "type": "object",
        "properties": {
          "id": {
            "type": "string",
            "pattern": "^[a-zA-Z|_][a-zA-Z0-9_]*$"
          },
          "name": {
            "type": "string"
          },
          "notes": {
            "type": "string"
          },
          "metadata": {
            "$ref": "#/definitions/metadata"
          },
          "kind": {
            "type": "string",
            "enum": ["collection", "classification", "partonomy"]
          },
          "members": {
            "type": "array",
            "items": {
              "type": "object",
              "properties": {
                "idRef": {
                  "type": "string",
                  "pattern": "^[a-zA-Z|_][a-zA-Z0-9_]*$"
                },
                "type": {
                  "type": "string"
                }
              },
              "required": ["idRef", "type"]
            }
          }
        },
        "required": ["kind", "members"]
      }
    },
    "user_defined_constraints": {
      "type": "array",
      "items": {
        "type": "object",
        "properties": {
          "id": {
            "type": "string",
            "pattern": "^[a-zA-Z|_][a-zA-Z0-9_]*$"
          },
          "name": {
            "type": "string"
          },
          "lower_bound": {
            "type": "number"
          },
          "upper_bound": {
            "type": "number"
          },
          "constraint_comps": {
            "type": "array",
            "items": {
              "type": "object",
              "properties": {
                "id": {
                  "type": "string",
                  "pattern": "^[a-zA-Z|_][a-zA-Z0-9_]*$"
                },
                "name": {
                  "type": "string"
                },
                "coefficient": {
                  "type": "number"
                },
                "variable": {
                  "type": "string"
                },
                "variable_type": {
                  "type": "string",
                  "enum": ["linear", "quadratic"]
                },
                "notes": {
                  "type": "string"
                },
                "metadata": {
                  "$ref": "#/definitions/metadata"
                }
              },
              "required": ["variable"],
              "additionalProperties": false
            }
          },
          "notes": {
            "type": "string"
          },
          "metadata": {
            "$ref": "#/definitions/metadata"
          }
        },
        "required": ["lower_bound", "upper_bound", "constraint_comps"],
        "additionalProperties": false
      }
    },
    "notes": {
      "type": "string"
    },
    "metadata": {
      "$ref": "#/definitions/metadata"
    }
  },
  "required": ["id", "reactions", "metabolites", "genes"],
  "additionalProperties": true
}
