{
    "compartments": {
        "c": "cytosol",
        "e": "extracellular"
    },
    "genes": [
        {
            "id": "G_b0755",
            "name": "gpmA"
        },
        {
            "id": "G_b0875",
            "name": "aqpZ"
        },
        {
            "id": "G_b1101",
            "name": "ptsG"
        },
        {
            "id": "G_b1380",
            "name": "ldhA"
        },
        {
            "id": "G_b1621",
            "name": "malX"
        },
        {
            "id": "G_b1676",
            "metadata": {
                "standardized": [
                    {
                        "qualifier": "bqb_is",
                        "resources": [
                            "https://identifiers.org/ncbiprotein:1208453",
                            "https://identifiers.org/ncbiprotein:1652654"
                        ]
                    }
                ]
            },
            "name": "pykF"
        },
        {
            "id": "G_b1723",
            "name": "pfkB"
        },
        {
            "id": "G_b1773",
            "name": "ydjI"
        },
        {
            "id": "G_b1779",
            "name": "gapA"
        },
        {
            "id": "G_b1817",
            "name": "manX"
        },
        {
            "id": "G_b1818",
            "name": "manY"
        },
        {
            "id": "G_b1819",
            "name": "manZ"
        },
        {
            "id": "G_b1854",
            "name": "pykA"
        },
        {
            "id": "G_b2097",
            "name": "fbaB"
        },
        {
            "id": "G_b2133",
            "name": "dld"
        },
        {
            "id": "G_b2415",
            "name": "ptsH"
        },
        {
            "id": "G_b2416",
            "name": "ptsI"
        },
        {
            "id": "G_b2417",
            "name": "crr"
        },
        {
            "id": "G_b2779",
            "metadata": {
                "standardized": [
                    {
                        "qualifier": "bqb_is",
                        "resources": [
                            "https://identifiers.org/ncbiprotein:1653839"
                        ]
                    }
                ]
            },
            "name": "eno"
        },
        {
            "id": "G_b2925",
            "name": "fbaA"
        },
        {
            "id": "G_b2926",
            "metadata": {
                "standardized": [
                    {
                        "qualifier": "bqb_is",
                        "resources": [
                            "https://identifiers.org/ncbiprotein:1653609"
                        ]
                    }
                ]
            },
            "name": "pgk"
        },
        {
            "id": "G_b2987",
            "name": "pitB"
        },
        {
            "id": "G_b3493",
            "name": "pitA"
        },
        {
            "id": "G_b3612",
            "name": "gpmM"
        },
        {
            "id": "G_b3916",
            "metadata": {
                "standardized": [
                    {
                        "qualifier": "bqb_is",
                        "resources": [
                            "https://identifiers.org/ncbiprotein:1006614",
                            "https://identifiers.org/ncbiprotein:1651919"
                        ]
                    }
                ]
            },
            "name": "pfkA"
        },
        {
            "id": "G_b3919",
            "name": "tpiA"
        },
        {
            "id": "G_b4025",
            "metadata": {
                "standardized": [
                    {
                        "qualifier": "bqb_is",
                        "resources": [
                            "https://identifiers.org/ncbiprotein:1653253"
                        ]
                    }
                ]
            },
            "name": "pgi"
        },
        {
            "id": "G_b4395",
            "name": "ytjC"
        },
        {
            "id": "G_s0001",
            "name": "G_s0001"
        }
    ],
    "groups": [],
    "id": "mini_textbook",
    "metabolites": [
        {
            "charge": -4,
            "compartment": "c",
            "formula": "C3H4O10P2",
            "id": "M_13dpg_c",
            "metadata": {
                "standardized": [
                    {
                        "qualifier": "bqb_is",
                        "resources": [
                            "http://identifiers.org/bigg.metabolite/13dpg",
                            "http://identifiers.org/biocyc/DPG",
                            "http://identifiers.org/chebi/CHEBI:16001",
                            "http://identifiers.org/chebi/CHEBI:1658",
                            "http://identifiers.org/chebi/CHEBI:20189",
                            "http://identifiers.org/chebi/CHEBI:57604",
                            "http://identifiers.org/chebi/CHEBI:11881",
                            "http://identifiers.org/hmdb/HMDB01270",
                            "http://identifiers.org/kegg.compound/C00236",
                            "http://identifiers.org/pubchem.substance/3535",
                            "http://identifiers.org/reactome/REACT_29800",
                            "http://identifiers.org/seed.compound/cpd00203",
                            "http://identifiers.org/unipathway.compound/UPC00236"
                        ]
                    }
                ]
            },
            "name": "3-Phospho-D-glyceroyl phosphate"
        },
        {
            "charge": -3,
            "compartment": "c",
            "formula": "C3H4O7P",
            "id": "M_2pg_c",
            "metadata": {
                "standardized": [
                    {
                        "qualifier": "bqb_is",
                        "resources": [
                            "http://identifiers.org/bigg.metabolite/2pg",
                            "http://identifiers.org/biocyc/2-PG",
                            "http://identifiers.org/chebi/CHEBI:1267",
                            "http://identifiers.org/chebi/CHEBI:58289",
                            "http://identifiers.org/chebi/CHEBI:17835",
                            "http://identifiers.org/chebi/CHEBI:21028",
                            "http://identifiers.org/chebi/CHEBI:11651",
                            "http://identifiers.org/chebi/CHEBI:12986",
                            "http://identifiers.org/chebi/CHEBI:24344",
                            "http://identifiers.org/chebi/CHEBI:39868",
                            "http://identifiers.org/hmdb/HMDB03391",
                            "http://identifiers.org/hmdb/HMDB00362",
                            "http://identifiers.org/kegg.compound/C00631",
                            "http://identifiers.org/pubchem.substance/3904",
                            "http://identifiers.org/reactome/REACT_30485",
                            "http://identifiers.org/seed.compound/cpd00482",
                            "http://identifiers.org/unipathway.compound/UPC00631"
                        ]
                    }
                ]
            },
            "name": "D-Glycerate 2-phosphate"
        },
        {
            "charge": -3,
            "compartment": "c",
            "formula": "C3H4O7P",
            "id": "M_3pg_c",
            "metadata": {
                "standardized": [
                    {
                        "qualifier": "bqb_is",
                        "resources": [
                            "http://identifiers.org/bigg.metabolite/3pg",
                            "http://identifiers.org/biocyc/G3P",
                            "http://identifiers.org/chebi/CHEBI:40016",
                            "http://identifiers.org/chebi/CHEBI:58272",
                            "http://identifiers.org/chebi/CHEBI:57998",
                            "http://identifiers.org/chebi/CHEBI:11879",
                            "http://identifiers.org/chebi/CHEBI:1657",
                            "http://identifiers.org/chebi/CHEBI:1659",
                            "http://identifiers.org/chebi/CHEBI:17050",
                            "http://identifiers.org/chebi/CHEBI:21029",
                            "http://identifiers.org/chebi/CHEBI:11882",
                            "http://identifiers.org/chebi/CHEBI:11880",
                            "http://identifiers.org/chebi/CHEBI:12987",
                            "http://identifiers.org/chebi/CHEBI:17794",
                            "http://identifiers.org/chebi/CHEBI:24345",
                            "http://identifiers.org/hmdb/HMDB00807",
                            "http://identifiers.org/kegg.compound/C00197",
                            "http://identifiers.org/kegg.compound/C00597",
                            "http://identifiers.org/pubchem.substance/3497",
                            "http://identifiers.org/reactome/REACT_29728",
                            "http://identifiers.org/seed.compound/cpd00169",
                            "http://identifiers.org/unipathway.compound/UPC00597",
                            "http://identifiers.org/unipathway.compound/UPC00197"
                        ]
                    }
                ]
            },
            "name": "3-Phospho-D-glycerate"
        },
        {
            "charge": -3,
            "compartment": "c",
            "formula": "C10H12N5O10P2",
            "id": "M_adp_c",
            "metadata": {
                "standardized": [
                    {
                        "qualifier": "bqb_is",
                        "resources": [
                            "http://identifiers.org/bigg.metabolite/adp",
                            "http://identifiers.org/biocyc/ADP",
                            "http://identifiers.org/biocyc/ADP-GROUP",
                            "http://identifiers.org/cas/58-64-0",